;meta[language=cz]
2110992199|65067e26||Zvyšuje efektivitu útoku proti nekrofágům. Efektivita se snižuje stíráním oleje z čepele během boje.
2110992200|65067e27||Zvyšuje efektivitu útoku proti nekrofágům. Efektivita se snižuje stíráním oleje z čepele během boje.
2110992201|7b1c29c3||Zvyšuje efektivitu útoku proti hybridům. Efektivita se snižuje stíráním oleje z čepele během boje.
2110992202|7b1c29c4||Zvyšuje efektivitu útoku proti hybridům. Efektivita se snižuje stíráním oleje z čepele během boje.
2110992203|7b1c29c5||Zvyšuje efektivitu útoku proti hybridům. Efektivita se snižuje stíráním oleje z čepele během boje.
2110992204|88e86911||Zvyšuje efektivitu útoku proti upírům. Efektivita se snižuje stíráním oleje z čepele během boje.
2110992205|88e86912||Zvyšuje efektivitu útoku proti upírům. Efektivita se snižuje stíráním oleje z čepele během boje.
2110992206|88e86913||Zvyšuje efektivitu útoku proti upírům. Efektivita se snižuje stíráním oleje z čepele během boje.
2110992207|aed490e2||Zvyšuje efektivitu útoku proti elementálům. Efektivita se snižuje stíráním oleje z čepele během boje.
2110992208|aed490e3||Zvyšuje efektivitu útoku proti elementálům. Efektivita se snižuje stíráním oleje z čepele během boje.
2110992209|aed490e4||Zvyšuje efektivitu útoku proti elementálům. Efektivita se snižuje stíráním oleje z čepele během boje.
2110992210|d11afcde||Zvyšuje efektivitu útoku proti lidem, elfům, trpaslíkům a půlčíkům. Efektivita se snižuje stíráním oleje z čepele během boje.
2110992211|d11afcdf||Zvyšuje efektivitu útoku proti lidem, elfům, trpaslíkům a půlčíkům. Efektivita se snižuje stíráním oleje z čepele během boje.
2110992212|d11afce0||Zvyšuje efektivitu útoku proti lidem, elfům, trpaslíkům a půlčíkům. Efektivita se snižuje stíráním oleje z čepele během boje.
2110992213|ea1a3189||Zvyšuje efektivitu útoku proti přeludům. Efektivita se snižuje stíráním oleje z čepele během boje.
2110992214|ea1a318a||Zvyšuje efektivitu útoku proti přeludům. Efektivita se snižuje stíráním oleje z čepele během boje.
2110992215|ea1a318b||Zvyšuje efektivitu útoku proti přeludům. Efektivita se snižuje stíráním oleje z čepele během boje.
2110992216|ef649cfe||Zvyšuje efektivitu útoku proti drakovitým. Efektivita se snižuje stíráním oleje z čepele během boje.
2110992217|ef649cff||Zvyšuje efektivitu útoku proti drakovitým. Efektivita se snižuje stíráním oleje z čepele během boje.
2110992218|ef649d00||Zvyšuje efektivitu útoku proti drakovitým. Efektivita se snižuje stíráním oleje z čepele během boje.
2110992219|f8b46c36||Zvyšuje efektivitu útoku proti reliktům. Efektivita se snižuje stíráním oleje z čepele během boje.
2110992220|f8b46c37||Zvyšuje efektivitu útoku proti reliktům. Efektivita se snižuje stíráním oleje z čepele během boje.
2110992221|1ff07bf8||Zvyšuje efektivitu útoku proti reliktům. Efektivita se snižuje stíráním oleje z čepele během boje.
2110992222|7753393f||Zvyšuje efektivitu útoku proti zlobrovitým. Efektivita se snižuje stíráním oleje z čepele během boje.
2110992223|77533940||Zvyšuje efektivitu útoku proti zlobrovitým. Efektivita se snižuje stíráním oleje z čepele během boje.
2110992224|77533941||Zvyšuje efektivitu útoku proti zlobrovitým. Efektivita se snižuje stíráním oleje z čepele během boje.
2110992225|c0218f12||Zvyšuje efektivitu útoku proti zlobrovitým. Efektivita se snižuje stíráním oleje z čepele během boje.
2110992226|c0218f13||Zvyšuje efektivitu útoku proti zlobrovitým. Efektivita se snižuje stíráním oleje z čepele během boje.
2110992227|c0218f14||Zvyšuje efektivitu útoku proti zlobrovitým. Efektivita se snižuje stíráním oleje z čepele během boje.
2110992228|dd8e2b22||Zvyšuje efektivitu útoku proti zvířatům. Efektivita se snižuje stíráním oleje z čepele během boje.
2110992229|dd8e2b23||Zvyšuje efektivitu útoku proti zvířatům. Efektivita se snižuje stíráním oleje z čepele během boje.
2110992230|dd8e2b24||Zvyšuje efektivitu útoku proti zvířatům. Efektivita se snižuje stíráním oleje z čepele během boje.
2110992231|de026195||Vyčistí toxicitu a zruší aktivní účinky všech lektvarů.
2110992232|de026196||Vyčistí toxicitu a zruší aktivní účinky všech lektvarů.
2110992233|de026197||Vyčistí toxicitu a zruší aktivní účinky všech lektvarů.
2110992234|        |item_desc_relic_oil_3|Zvyšuje efektivitu útoku proti reliktům.
2110992235|874e9f88||Propůjčí zrak v naprosté tmě a imunitu proti hypnóze. Prodloužené trvání.
2110992237|fe608837||Způsobí poškození střepinami všem protivníkům v dosahu výbuchu. Způsobuje poškození ohněm. Vylepšený účinek. Zničí protivníkovi štít. Zničí hnízdo příšer.
2110992239|        |attribute_name_duration_out_of_cloud|Trvání oblaku
2110992240|874e9f87||Propůjčuje zrak v naprosté tmě. Prodloužené trvání.
2110992241|e71d7c8e||All your melee attacks cost $S$% more Stamina. Successful melee attack additionally reduces victim's health by $S$% of its current value per each Stamina point spent on the attack.
2110992242|fc921527||Each Lesser Green Mutagen equipped increases your Vitality regeneration rate by $S$/sec. Green Mutagen increases the bonus to $S$/sec and Greater Green Mutagen - to $S$/sec.
2110992243|e71d7c93||Each Lesser Blue Mutagen equipped increases base damage dealt with signs by $S$ points. Blue Mutagen increases the bonus to $S$ and Greater Blue Mutagen - to $S$.
2110992244|fc921524||Increases the witcher's resistance to bleeding, burning, poison effects as well as to fire and poison damage by $I$%.
2110992245|fc921525||Regenerates Vitality by $S$% for each point of Stamina spent. Works only while in combat.
2110992246|e71d7c91||Regenerates Vitality by $S$% of the damage dealt to an enemy.
2110992247|fc921505||Casting a sign increases your melee Attack Power by $I$% (max $I$%). Resets after dealing melee damage and at the end of the combat.
2110992248|fc921509||Enemies controlled by Axii Puppet deal $I$% more damage.
2110992249|fc921526||Casting a Sign in combat increases your Sign Intensity by $S$% (max $S$%). Getting hit decreases the bonus proportional to damage received: $S$% per 1% of health lost. Resets at the end of the combat.
2110992250|        |option_gm_rnd_scaling_min_slider|Náhodné zvýšení úrovně nepřátel: min.
2110992251|        |option_gm_rnd_scaling_max_slider|Náhodné zvýšení úrovně nepřátel: max.
2110992252|        |preset_value_gm_es_random|Náhodně
2110992253|        |option_gm_no_quest_levels_toggle|Vypnout doporučenou úroveň pro plnění úkolů: 
2110992254|        |option_gm_no_animal_upscaling_toggle|Nezvyšovat úroveň zvířat:
2110992255|        |preset_value_gm_es_random_no_down|Náhodně, bez snížení úrovně
2110992256|        |item_desc_note|Obsahuje neužitečné informace.
2110992257|        |gm_recycling_parts|Výrobní součásti
2110992258|25691b0a||Může být prodáno obchodníkům nebo rozebráno na výrobní součásti.
2110992259|        |item_desc_junk_no_ingr|Může být prodáno obchodníkům.
2110992260|7fd2ce90||Může být prodáno za vysokou cenu nebo rozebráno na výrobní součásti.
2110992261|        |PanelStash|Menu uložiště
2110992262|        |effect_undying_cooldown|Reaktivace účinků schopnosti Nehynoucí
2110992263|        |attribute_name_staminaRegen_armor_mod|Modifikátor regenerace výdrže
2110992264|        |attribute_name_chanceToIgnoreHitAnim|Šance na udržení rovnováhy při zasažení protivníkem
2110992265|        |attribute_name_q108_bounce_arrows|Šance na odražení šípu
2110992266|        |item_name_repair_kit_weapon_4|Nástroje mistra kováře
2110992267|        |item_desc_repair_kit_weapon_4|Kovářské nástroje mistra kováře. Permanentně zvyšuje poškození zbraně.
2110992268|        |item_name_repair_kit_armor_4|Nástroje mistra zbrojíře
2110992269|        |item_desc_repair_kit_armor_4|Kovářské nástroje mistra zbrojíře. Permanentně zvyšuje obranu zbroje.
2110992270|        |option_gm_quest_exp_slider|Modifikátor zkušeností za plnění úkolů:
2110992271|        |option_gm_monster_exp_slider|Modifikátor zkušeností za vyhrané souboje:
2110992272|        |attribute_name_knockdown|Šance na sražení            
2110992273|b1173fc2||Increases base heavy knockdown chance by $I$%.
2110992274|163a8e76||Přidává $I$ bodů k poškození ohněm a $I$ bodů k poškození proudem ohně za sekundu. Scales with Sign Intensity.
2110992275|b1173fc6||Přidává $I$ bodů k poškození magickou střílnou. Scales with Sign Intensity.
2110992276|b1173fc5||Přidává $I$ bodů k pohlcenému poškození štítem. Scales with Sign Intensity.
2110992277|        |gm_sign_stats_axii_duration_confusion|Trvání účinku zmatení
2110992278|        |gm_sign_stats_axii_duration_control|Trvání účinku ovládnutí
2110992279|163a8e70||Alternativní režim znamení:<br>Aard zasáhne všechny protivníky v dosahu. Intenzita znamení je v tomto režimu o $I$% nižší.
2110992280|71d0be23||Alternativní režim znamení:<br>Aard zasáhne všechny protivníky v dosahu. Intenzita znamení je v tomto režimu o $I$% nižší.
2110992281|71d0be24||Alternativní režim znamení:<br>Aard zasáhne všechny protivníky v dosahu. Intenzita znamení se v tomto režimu nadále nesnižuje.
2110992282|71d0d0e8||Aard nyní způsobuje $I$ poškození. Poškození se zvyšuje s intenzitou znamení. Současné poškození: $I$.
2110992283|71d0d0e9||Aard nyní způsobuje $I$ poškození. Poškození se zvyšuje s intenzitou znamení. Současné poškození: $I$.
2110992284|cf2b2d9f||A directed blast of telekinetic energy that staggers opponents and has $I$% knockdown chance. Heavy knockdown chance is $I$%. Chances scale with Sign Intensity and increase if enemy is low on Stamina. Heavy knockdown activates finisher move.
2110992286|cf2b2da3||Charms an opponent's mind, confusing them and temporarily eliminating them from combat. Failed Axii attempts stagger the opponent. Grants a $S$% chance to critically hit confused enemy. Can trigger a finisher or dismemberment on a confused enemy with $S$% chance (scales with Sign Intensity and damage severity). <br>Confusion duration: $S$ seconds (scales with Sign Intensity).
2110992287|b1173fc8||Doba trvání účinků Axie se zvyšuje o $I$%.
2110992288|163a8e74||Alternativní režim znamení:<br>Zaměřený nepřítel se na $I$ sekund stane Geraltovým spolubojovníkem a získá $I$% bonus k síle útoku. Trvání účinku se zvyšuje s intenzitou znamení. Současné trvání: $I$ sekund.
2110992289|71d0cd27||Alternativní režim znamení:<br>Zaměřený nepřítel se na $I$ sekund stane Geraltovým spolubojovníkem a získá $I$% bonus k síle útoku. Trvání účinku se zvyšuje s intenzitou znamení. Současné trvání: $I$ sekund.
2110992290|71d0cd28||Alternativní režim znamení:<br>Zaměřený nepřítel se na $I$ sekund stane Geraltovým spolubojovníkem a získá $I$% bonus k síle útoku. Trvání účinku se zvyšuje s intenzitou znamení. Současné trvání: $I$ sekund.
2110992291|483c9092||While in combat, weapon damage increases by $I$ points per enemy. Each successful hit charges the sword. Fully charged sword discharges on successful hit, dealing critical damage with $I$% Attack Power bonus and ignoring Armor and damage resistances. Sword discharge also damages and staggers all the surrounding enemies.<br><br>Hits to fully charge the sword: $I$. Charges decay over time (one per $I$ sec.) and reset when Geralt takes damage.
2110992292|1f5adb4f||<br><br>Current charges: $I$/$I$. Current damage bonus: $I$ points.
2110992293|        |gm_sign_stats_heavy_knockdown|Šance na sražení k zemi
2110992294|f76f46ed||Killing an enemy heals $I$% of maximum Vitality.
2110992295|fad8f82b||Killing an enemy gives $F$ Adrenaline Points.
2110992296|ed2f3195||Damage dealt by Quen Discharge and Exploding Shield is increased by $I$%.
2110992299|f2e69faf||Dealing damage with attacks charges the sword with energy. When attacking with the fully charged sword, weapon damage is increased by $I$% of the player's Vitality (if the attack is successful, player's Vitality is drained). A strong attack with the fully charged sword spawns a phantom copy of the sword that deals additional damage, which goes through shields, blocks and Armor and ignores damage resistances.<br><br>Hits to fully charge the sword: $I$. Charges decay over time (one per $I$ sec.) and reset when Geralt takes damage. Fully charged sword discharges in $I$ sec. or after a strong attack.<br><br>Current charges: $I$/$I$. Current damage bonus for the fully charged sword: $I$ points.
2110992300|        |option_gm_use_xml_exp_toggle|Splnění všech úkolů a vyhraných bojů dává stejný počet zkušeností:
2110992301|        |gm_kills_humans|Humanoidi
2110992302|        |gm_kills_wh_warriors|Bojovníci Divokého honu
2110992303|        |gm_kills_total|Celkové množství zabití
2110992304|        |gm_kills_animals_total|Zvířata
2110992305|        |gm_kills_monsters_total|Příšery
2110992306|        |gm_kills_by_type|Zabití dle kategorie
2110992307|        |gm_kills_kill_count|Počet zabití
2110992308|        |gm_kills_humans_total|Humanoidi
2110992309|        |gm_kills_bosses_total|Unikátní bytosti/Bossové
2110992310|1f70c026||Zvyšuje šanci na kritický zásah kuší o $I$% a sílu kritického zásahu o $I$%.
2110992312|        |option_gm_stash_sync_toggle|Použije režim synchronizace uložiště jako výchozí nastavení:
2110992313|da7e5ba8||Pokud máš alespoň jeden bod adrenalinu, použije se na seslání znamení místo výdrže.
2110992314|        |option_gm_no_add_levels_guards|Žádné dodatečné navýšení úrovně stráží:
2110992315|329005f1||Wolf School defensive techniques: parry, counter, dodge. Successful parry, counter and dodge reduce damage taken to zero and prevent all negative effects. Successful countering grants additional $I$% chance to critical hit. Partial parry reduces damage taken by $I$% and prevents bleeding. Rolling grants immunity to all knockdown and stagger effects and allows to dodge arrows. Some of the attacks cannot be dodged. Arrows can be parried.
2110992316|1f70c028||Decreases the graze damage taken while dodging by $I$%.
2110992317|8d17aaa0||Snižuje utržené poškození od příšer (dle druhu), pokud se proti nim použije typ oleje, vůči kterému jsou zranitelní, o $I$%. Enhanced oil additionally reduces the damage by $I$% and Superior - by $I$%. Effectiveness decreases with oil rubbing off the blade (down to $I$% of the original value).
2110992318|5f63dbf4||Umožňuje výrobu olejů, které mohou být aplikovány na meče. Efektivita se snižuje stíráním oleje z čepele během boje (down to $I$% of the original value).
2110992319|754d1890||Increases Adrenaline gain by $I$%. In addition to usual Battle Trance effect, each Adrenaline Point also decreases melee action Stamina cost by $I$%.
2110992320|        |item_desc_armor_type_heavy_set_bonus|Bonus za set těžké zbroje: +$I$% ke všem odolnostem vůči poškození.
2110992321|        |item_desc_armor_type_medium_set_bonus|Medium armor set bonus: +$S$/sec to Toxicity Decay Rate.
2110992322|        |item_desc_armor_type_light_set_bonus|Bonus za set lehké zbroje: +$I$ ke stupňům bezpečného úhlu vzdálenosti během úniku/piruety.
2110992323|        |skill_desc_viper_set_ability1|Dáva imunitu vůči jedům. Jedy léčí $S$% poškození jedem za každou část stejného vybaveného setu (současné množství obnoveného zdraví: $S$%).
2110992324|        |gm_stat_attack_power_levelup_bonus|Bonus silného útoku
2110992325|d23efdaf||Taking damage increases your Adrenaline by $S$ points per set piece equipped (current bonus: $S$ points). Each Adrenaline point additionally increases your Attack Power by $S$% per set piece equipped (current bonus: $S$%).
2110992326|85e8fbd2||Na meč mohou být současně aplikovány až tři různé typy oleje. Každý na meč aplikovaný olej zvyšuje šanci na kritický zásah o $S$% a sílu kritického útoku o $S$%.
2110992327|        |panel_gm_scaling_options|Navyšování úrovně nepřátel
2110992328|        |panel_gm_exp_options|Zkušenosti
2110992329|        |panel_gm_gameplay_options|Hratelnost
2110992330|        |item_name_dismantle_kit_gear_1|Nářadí na rozebrání předmětů
2110992331|        |item_desc_dismantle_kit_gear_1|Umožňuje rozebrat nepotřebné předměty a výrobní součásti.
2110992332|        |item_name_dismantle_kit_alchemy_1|Nářadí na rozebrání alchymistických předmětů
2110992333|        |item_desc_dismantle_kit_alchemy_1|Umožňuje rozebrat alchymistické součásti.
2110992334|        |panel_button_hud_interaction_dismantle|Rozebrat
2110992336|d23efdb0||Damage dealt with a strong attack restores $S$% Stamina spent on that attack.
2110992337|e9c58057||Casting a Sign costs $I$% less Stamina, but all melee actions (except for special attacks) cost $I$% more Stamina.
2110992338|eb7a58f6||All damaging melee actions (except for special attacks) cost $I$% more Stamina, but deal $I$% more damage.
2110992339|e810a7b8||All melee actions (except for special attacks) cost $I$% less Stamina, but all Signs cost $I$% more Stamina.
2110992342|cea7442f||You always enter combat with at least $S$ Adrenaline Point(s). The generation of Adrenaline Points is increased by $I$%.
2110992343|        |effect_dimeritium|Dwimerit
2110992344|63cd93a3||Releases a cloud of dimeritium slivers that block primitive magic and monsters' magic abilities. Weakens Armor of magic creatures. Weakens mages, reducing their damage.
2110992345|63cd93a4||Releases a cloud of dimeritium slivers that block primitive magic and monsters' magic abilities. Weakens Armor of magic creatures. Weakens mages, reducing their damage. Lasts longer.
2110992346|63cd93a5||Releases a cloud of dimeritium slivers that block primitive magic and monsters' magic abilities. Weakens Armor of magic creatures. Weakens mages, reducing their damage. Lasts longer.
2110992347|        |attribute_name_dbomb_armor_piercing|Proražení zbroje
2110992348|        |attribute_name_cloud_duration|Trvání oblaku
2110992349|15dda91c||Every known level 1, 2 and 3 potion, bomb and oil formula, alchemy substance and mutagen decoction formula increases maximum Toxicity by 1 point, up to +$I$ points max. Current bonus is $I$ points.
2110992350|1517ddcf||Every known level 1, 2 and 3 potion, bomb and oil formula, alchemy substance and mutagen decoction formula increases maximum Toxicity by 1 point, up to +$I$ points max. Current bonus is $I$ points.
2110992351|1517ddd0||Every known level 1, 2 and 3 potion, bomb and oil formula, alchemy substance and mutagen decoction formula increases maximum Toxicity by 1 point, up to +$I$ points max. Current bonus is $I$ points.
2110992352|        |attribute_name_staminaRestore|Výdrž
2110992353|0083ce65||Prodloužené účinky
2110992354|8d17aa9f||Extends potion duration time by $S$%.
2110992355|15dda919||Toxicity drops $S$ points per second faster.
2110992358|8d17aa9e||Decreases potion toxicity by $S$ points.
2110992359|0083ce64||Expert brewer
2110992360|        |item_name_kaer_morhen_armor|Kaer Morhenská zbroj
2110992361|        |item_name_kaer_morhen_armor_1|Vylepšená Kaer Morhenská zbroj
2110992362|        |item_name_kaer_morhen_armor_2|Prvotřídní Kaer Morhenská zbroj
2110992363|        |item_name_kaer_morhen_armor_3|Mistrovská Kaer Morhenská zbroj
2110992364|        |item_name_kaer_morhen_pants|Kaer Morhenské kalhoty
2110992365|        |item_name_kaer_morhen_pants_1|Vylepšené Kaer Morhenské kalhoty
2110992366|        |item_name_kaer_morhen_pants_2|Prvotřídní Kaer Morhenské kalhoty
2110992367|        |item_name_kaer_morhen_pants_3|Mistrovské Kaer Morhenské kalhoty
2110992368|        |item_name_kaer_morhen_boots|Kaer Morhenské boty
2110992369|        |item_name_kaer_morhen_boots_1|Vylepšené Kaer Morhenské boty
2110992370|        |item_name_kaer_morhen_boots_2|Prvotřídní Kaer Morhenské boty
2110992371|        |item_name_kaer_morhen_boots_3|Mistrovské Kaer Morhenské boty
2110992372|        |item_name_kaer_morhen_gloves|Kaer Morhenské rukavice
2110992373|        |item_name_kaer_morhen_gloves_1|Vylepšené Kaer Morhen rukavice
2110992374|        |item_name_kaer_morhen_gloves_2|Prvotřídní Morhenské rukavice
2110992375|        |item_name_kaer_morhen_gloves_3|Mistrovské Morhenské rukavice
2110992376|        |item_name_starting_armor_gm|Obnošená Kaer Morhenská zbroj
2110992377|        |item_name_starting_pants_gm|Obnošené Kaer Morhenské kalhoty
2110992378|        |item_name_starting_boots_gm|Obnošené Kaer Morhenské boty
2110992379|        |item_name_starting_gloves_gm|Obnošené Kaer Morhenské rukavice
2110992380|        |skill_desc_kaer_morhen_set_ability1|Rychlost regenerace výdrže se zvyšuje o $S$ za každého dodatečného protivníka v boji (max. $S$).
2110992381|        |attribute_name_toxicity_offset|Vyrovnání toxicity
2110992382|        |gm_toxicity_offset_description|Vyrovnání toxicity si vyhrazuje množství tvé maximální toxicity po dobu trvání účinku odvaru.
2110992383|        |gm_stat_adrenaline_gain_light|Zisk adrenalinu rychlým útokem
2110992384|        |gm_stat_adrenaline_gain_heavy|Zisk adrenalinu silným útokem
2110992386|d02fd0a4||Once they reach their maximum level, Adrenaline Points steadily decline until they reach zero at a rate of $S$ points per sec. During this time Vitality regenerates faster by $S$%/sec, Stamina regenerates faster by $S$%/sec, and Toxicity declines faster by $S$ points/sec.
2110992387|f098e2d3||Igni's basic attack strikes all opponents in a 360-degree radius and deals $I$ more damage (scales with Sign Intensity). Burning chance is decreased by $I$%.
2110992388|fc92152b||Getting hit more than once within $S$ sec makes you immune to damage for the next $S$ sec.
2110992389|e71d7c8c||When enemies damage you in melee combat, they get an Acid effect that reduces their Damage Resistance by $I$% (max $I$%).
2110992390|fc92152c||Damage dealt to enemies in spectral form is increased from $I$% to $I$% of normal damage. Damage taken from enemies in spectral form is reduced by $I$%.
2110992391|        |option_gm_cbtsreg|Combat stamina regen (additional)
2110992392|        |option_gm_ocbtsreg|Out of combat stamina regen (additional)
2110992393|        |option_gm_cbtvreg|Combat vitality regen (additional)
2110992394|        |option_gm_ocbtvreg|Out of combat vitality regen (additional)
2110992395|        |option_gm_mscost|Melee action cost modifier
2110992396|        |option_gm_sscost|Sign action cost modifier
2110992397|        |option_gm_stdelay|Stamina regen delay (additional, seconds)
2110992398|dd7afaaa||Attack is the Best Defense
2110992399|754d18b0||Killing an enemy restores $I$% of your Stamina (no cooldown). Critical hits and successful counters restore $I$% of your Stamina ($S$ sec cooldown).
2110992400|        |effect_whirl_cooldown|Whirl cooldown
2110992401|        |effect_rend_cooldown|Rend cooldown
2110992402|        |effect_aard_cooldown|Aard cooldown
2110992403|        |effect_igni_cooldown|Igni cooldown
2110992404|        |effect_yrden_cooldown|Yrden cooldown
2110992405|        |effect_quen_cooldown|Quen cooldown
2110992406|        |effect_axii_cooldown|Axii cooldown
2110992407|        |option_gm_mcooldown|Melee special cooldown (seconds)
2110992408|        |option_gm_scooldown|Sign cooldown (seconds)
2110992409|        |attribute_name_stamina_cost_light|Fast attack stamina cost
2110992410|        |attribute_name_stamina_cost_heavy|Strong attack stamina cost
2110992411|        |attribute_name_stamina_cost_parry|Parry stamina cost
2110992412|        |attribute_name_stamina_cost_counter|Counter stamina cost
2110992413|        |attribute_name_stamina_cost_dodge|Dodge stamina cost
2110992414|        |attribute_name_stamina_cost_roll|Roll stamina cost
2110992415|        |attribute_name_stamina_cost_sprint|Sprint stamina cost
2110992416|        |attribute_name_stamina_cost_jump|Jump stamina cost
2110992417|        |attribute_name_stamina_cost_item|Use item stamina cost
2110992418|        |attribute_name_stamina_cost_aard|Aard stamina cost
2110992419|        |attribute_name_stamina_cost_igni|Igni stamina cost
2110992420|        |attribute_name_stamina_cost_yrden|Yrden stamina cost
2110992421|        |attribute_name_stamina_cost_quen|Quen stamina cost
2110992422|        |attribute_name_stamina_cost_axii|Axii stamina cost
2110992423|        |attribute_name_tox_hp_drain|Overdose Vitality drain
2110992424|        |attribute_name_tox_dec_rate|Toxicity Decay Rate
2110992425|        |attribute_name_avail_tox|Available Toxicity
2110992426|736e017e||Light gear. Offers minimal protection. Combat actions require less stamina.
2110992427|320650a7||Medium gear. Offers optimal protection.
2110992428|942892ef||Heavy gear. Offers the best protection. Combat actions and sign casting require more stamina.
2110992429|6d1ad461||Light Armor does not provide much protection, but your combat actions require less stamina when it is equipped. Medium Armor and Heavy Armor absorb more damage, but while in Heavy Armor your combat actions require more stamina.
2110992430|4080bc95||Dealing damage in combat heals $S$% of maximum Vitality for each piece of the set (currently $S$%).
2110992431|        |option_gm_ascooldown|Alternate Sign cooldown (seconds)
2110992432|        |option_gm_sign_instant_cast_toggle|Instant sign casting with sign select key
2110992433|9ec8a224||Immediately restores a portion of Vitality and stops bleeding.
