;meta[language=cz]
2110992434|9ec8a225||Immediately restores a large portion of Vitality and stops bleeding.
2110992435|9ec8a226||Restores Vitality immediately and fully and stops bleeding. Grants immunity to damage for a short duration.
2110992436|fc921529||Each Lesser Red Mutagen equipped decreases melee action stamina cost by $S$%. Red Mutagen increases the bonus to $S$% and Greater Red Mutagen - to $S$%.
2110992438|        |attribute_name_stamina_cost_whirl|Whirl stamina cost
2110992439|        |attribute_name_stamina_cost_rend|Rend stamina cost
2110992440|        |attribute_name_dismember_chance|Dismember chance
2110992441|        |panel_gm_qol_options|QoL
2110992442|        |option_gm_lowstamsfx|Low stamina sfx threshold (percents)
2110992443|        |option_gm_lowstamsfx_vol|Low stamina sfx volume
2110992444|        |option_gm_lowstamsfx_dynvol|Use dynamic low stamina sfx volume
2110992445|        |option_gm_lowstamsfx_rate|Low stamina sfx rate
2110992446|        |option_gm_lowstamsfx_dynrate|Use dynamic low stamina sfx rate
2110992447|        |preset_Mods_ghost_mode_gm_qol_options|QoL Presets
2110992448|        |preset_value_gm_recommended|Recommended
2110992449|        |preset_value_gm_turn_off|Off
2110992450|        |preset_Mods_ghost_mode_gm_gameplay_options|Gameplay Presets
2110992451|        |preset_value_gm_default|Default
2110992452|        |preset_Mods_ghost_mode_gm_exp_options|Experience Presets
2110992453|        |preset_Mods_ghost_mode_gm_scaling_options|Scaling Presets
2110992454|15dda917||When consumed, mutagen decoction increases maximum Vitality by $I$ points per each toxicity offset point for decoction's effective duration.
2110992455|e71d7c8b||Non-critical damage dealt with a sword increases Critical hit chance for subsequent attacks by $I$% (max $I$%). When at max bonus, receive additional $I$% to Critical hit power. Bonus resets on successful critical hit and at the end of the combat.
2110992456|        |attribute_name_dbomb_dmg_reduction|Damage reduction
2110992457|fc92150b||Hit Reaction Severity is reduced to zero, if damage received is less than $I$% of your maximum Health.
2110992458|        |option_gm_armor_reg_penalty|Enable stamina regen penalty for armors
2110992459|        |preset_value_gm_old_ver|Vanilla(ish)
2110992460|        |skill_desc_magic_s10_l3|Magic Trap duration increases by $I$%. Can now place an additional Magic Trap.
2110992461|        |gm_sign_stats_yrden_range|Magic Trap Range
2110992462|dd7afa8f||Connoisseur
2110992463|754d1895||Reduces alcohol and toxic food toxicity to zero. Removes drunken effect from alcohol. After drinking an alcoholic beverage, its bonuses last longer by $S$%.
2110992464|a1370329||Increases breath supply while underwater and improves vision while diving.
2110992471|1b06cd09||Whenever you slay an enemy, time slows for a short period.
2110992474|        |gm_crafting_bonus_title|Bonus for gear type:
2110992475|        |item_name_caretaker_spade_desc|Restores Vitality proportional to damage dealt.
2110992476|2ae9db22||Vitality drain
2110992477|e71d7c8d||All bombs and potions (but not decoctions) can be used one additional time.
2110992478|fc921506||Increases critical hit power by $I$% when attacking from behind.
2110992479|fc92152a||$I$% of the damage taken by the witcher is reflected back on the attacker.
2110992480|        |attribute_name_dbomb_resist_reduction|Damage resistance reduction
2110992481|fc92150e||When the witcher is attacked from behind, normal Quen gets activated and reduces the damage. When hostile specters are around, Quen Power is increased by $S$%.
2110992482|        |attribute_name_hpPercDamageBonusPerHit|Damage bonus
2110992483|        |attribute_name_resistance_perc_bonus_descr|Damage resistances
2110992484|fc92150c||Damage dealt with a melee weapon increases Sign Intensity by $I$% (max $I$%). Resets after casting a sign and at the end of the combat.
2110992485|e71d7c8f||Dealing melee damage to enemies increases your Attack Power by $S$% (max $S$%). Getting hit decreases the bonus proportional to damage received: $S$% per 1% of health lost. Resets at the end of the combat.
2110992486|fc92150a||Dealing melee damage to enemies increases your Adrenaline Gain by $S$% (max $S$%). Getting hit decreases the bonus proportional to damage received: $S$% per 1% of health lost. Resets at the end of the combat.
2110992487|fc921528||Gain +$I$% to Attack Power, +$I$% to Sign Intensity, +$I$/s to Stamina regeneration and +$I$% to Adrenaline gain while your health is at $I$% or lower. Resets when you regain your health and at the end of the combat. $I$ sec cooldown.
2110992488|fc921507||Gain +$I$ to non-combat Vitality regeneration and +$I$ to combat Vitality regeneration. When your Stamina is at $I$% and below, gain another +$I$ to combat Vitality regeneration.
2110992489|fc92150d||When you kill a foe, gain +$I$ to Vitality regeneration per each alive enemy nearby. Max bonus cannot exceed +$I$. Resets at the end of the combat.
2110992490|fc921508||When you kill a foe, gain +$I$ to combat Stamina regeneration per each alive enemy nearby. Max bonus cannot exceed +$I$. Resets at the end of the combat.
2110992491|754d1896||You ignore bomb and special bolt effects. Damage from own bombs and bolts is halved.
2110992492|8d17aaa2||Critical hit power against the targeted enemy type is increased by $S$% for each Adrenaline Point available (up to $S$% max).
2110992493|        |effect_melt_armor_timer|Melt Armor Timer
2110992494|        |option_gm_ascost|Sprint/jump action cost modifier
2110992495|        |option_gm_nonlinear_levelup_toggle|Use progressive level bonuses
2110992496|        |option_gm_nonlinear_level_delta_slider|Level delta
2110992497|        |option_gm_nonlinear_abs_delta_slider|Abilities per level delta
2110992498|        |preset_value_gm_hardcore|Hardcore
2110992499|eee40a34||Hitting enemies with Aard reduces their Stamina by $I$%, which also increases knockdown and heavy knockdown chances.
2110992500|c5f2bcea||Increases the range of Whirl by $S$ yards and Rend by $S$ yards. Final damage dealt by these attacks is decreased by $S$%.
2110992501|257f1e14||When you enter combat, you will automatically get a Quen shield without using any Stamina and with $I$% bonus to Sign Power.
2110992502|c43de44b||After you cast a Sign, an Adrenaline Point is consumed and your next sword attack is charged with the power of that Sign. Aard: knockdown (chances depend on Attack Power). Igni: $S$% of your weapon damage is added as Fire damage (scales with Attack Power). Yrden: slowdown effect is applied for $S$ sec. Quen: heals Geralt for $S$% of damage dealt. Axii: confusion effect is applied for $S$ sec.
2110992504|0083ce63||Restoration
2110992505|0083ce62||Refreshment
2110992506|8d17aa9c||Each potion dose imbibed restores $I$% of maximum Stamina.
2110992507|f9241f8c||Excess Adrenaline generated slows down potion expiration timer by $S$% per 1% of excess Adrenaline (3 points = 100%). Max bonus cannot exceed $S$%. The bonus resets when you lose Adrenaline and at the end of the combat.
2110992508|        |attribute_name_explosionFireDamage|Fire damage on explosion
2110992510|cea74419||When casting a Sign, 3 Adrenaline Points (if available) will be consumed to upgrade the Sign to the highest level (unlocking all bonuses) and increase Sign intensity by $I$%. If Rage Management is active, Adrenaline Points are not consumed immediately, but sign casting cost is tripled instead.
2110992511|c1e6ad8c||When casting a Sign, 3 Adrenaline Points (if available) will be consumed to upgrade the Sign to the highest level (unlocking all bonuses) and increase Sign intensity by $I$%. If Rage Management is active, Adrenaline Points are not consumed immediately, but sign casting cost is tripled instead.
2110992512|c1e6ad8d||When casting a Sign, 3 Adrenaline Points (if available) will be consumed to upgrade the Sign to the highest level (unlocking all bonuses) and increase Sign intensity by $I$%. If Rage Management is active, Adrenaline Points are not consumed immediately, but sign casting cost is tripled instead.
2110992513|e2e48f8a||Deflection
2110992514|cea74410||Damage taken from partial parries and counters is reduced by additional $I$% (to $I$% total). Perfectly timed parries reflect arrows back at the attacker.
2110992515|c1e68bc3||Damage taken from partial parries and counters is reduced by additional $I$% (to $I$% total). Perfectly timed parries reflect back arrows, damage on reflected arrows is increased by $I$%.
2110992516|4e736cfc||Foes killed by Igni (burning or fire) explode dealing $I$ damage to other enemies within a $I$-yard radius and igniting them. Damage scales with Sign Intensity.
2110992517|198d31bb||Each enemy controlled by Axii Puppet adds $I$% to your Attack Power and Sign Intensity (up to $I$%).
2110992518|20609437||Each enemy affected by Axii Confusion adds $I$% to your critical hit chance and critical hit power (up to $I$%).
2110992519|        |attribute_name_tox_overdose|Overdose threshold
2110992520|b93269f0||Your opponents have limited Stamina. When their Stamina is exhausted, they won't be able to fight as effectively.
2110992521|6d1ad3cb||Pay attention to the color of your enemies' level numbers. Green means they are close to your level. Red means they are a challenge, and a skull icon means they are deadly.
2110992522|6d1ad3a6||Sharpening your blade on a grindstone will enhance its combat capabilities.
2110992523|6d1ad427||Strike an opponent while riding towards him at high speed for an increased damage.
2110992524|b93269e9||Striking from behind increases you critical hit chances.
2110992525|6d1ad3e4||When throwing a bomb or shooting a bolt from your crossbow, you can either take advantage of auto-aiming for a quick attack, or aim manually for better damage.
2110992526|6d1ad447||You can deflect incoming bolts and arrows with your sword.
2110992527|363f99af||You can use Quen to protect from critical effects such as Burning, Bleeding, etc.
2110992528|6d1ad3cc||Dodging is usually the best tactic when fighting huge monsters. When fighting humans and smaller monsters, try to parry and counter their attacks with your sword.
2110992529|c3f5389e||Turns the blood of the witcher into a highly caustic acid. Toxicity Decay Rate is decreased by $S$%. Whenever you take melee damage, your blood causes the attacker to lose $S$ point(s) of their health for every 1 point in your Toxicity level per second (current value: $S$ pts; max value: $S$ pts). The effect lasts $S$ sec. Slows down the attacker's stamina regeneration by $S$%.
2110992530|3a84c328||Increases poison resistance, neutralizes the effects of poisons already in bloodstream.
2110992531|3a84c329||Increases poison resistance, neutralizes the effects of poisons already in bloodstream. Extended duration.
2110992532|3a84c32a||Increases poison resistance, neutralizes the effects of poisons already in bloodstream. Extended duration. Grants temporary immunity to poison effects.
2110992533|        |attribute_name_poison_immunity_duration|Poison immunity duration
2110992534|437e276a||Accelerates Stamina regeneration.
2110992535|437e276b||Accelerates Stamina regeneration.
2110992536|437e276c||Accelerates Stamina regeneration. Never expires at night.
2110992537|56747c55||Stops bleeding and increases bleeding resistance. Accelerates Vitality regeneration. Vitality regeneration pauses for 2 seconds upon receiving damage.
2110992538|56747c56||Stops bleeding and increases bleeding resistance. Accelerates Vitality regeneration. Vitality regeneration pauses for 2 seconds upon receiving damage.
2110992539|56747c57||Stops bleeding and increases bleeding resistance. Accelerates Vitality regeneration. Taking damage does not interrupt Vitality regeneration.
2110992540|c3f5389f||When you are about to take damage your skin absorbs and redistributes that damage over time instead: $S$ sec per each Adrenaline Point you have (up to $S$ sec max, at least 1 point is required to trigger the mutation). During this period your Adrenaline is drained at a speed of 1 pt per $S$ sec. If your Adrenaline reaches zero before the effect ends, all the remaining damage will be dealt at once.
2110992541|c3f538a2||Countering an enemy when their health is at $S$% or less kills them and triggers a finisher or dismemberment. Each Adrenaline Point increases the damage dealt when countering by $S$% (up to +$S$% max).
2110992542|363f9a0c||Deadly Precision is activated only when performing a counterattack.
2110992543|c3f5389d||Each fatal blow of your sword triggers a finisher or dismemberment. Upon entering combat you immediately get a bonus to your Attack Power for each skill equipped: +$S$% for a combat skill, +$S$% for any other skill. Getting hit decreases the bonus by $S$% per 1% of health lost. Killing an enemy fully restores the bonus and adds +$S$% more on top of it. Max bonus: $S$%. Resets at the end of the combat.
2110992544|        |item_name_mutation_trigger|Mutation Catalyst
2110992545|        |item_desc_mutation_trigger|This potion serves as a catalyst to activate Life Leech mutation.
2110992546|bab1daf6||Requires Mutation Catalyst potion to activate. Drains the life out of up to three surrounding enemies healing the witcher in the process. Drain rate is a sum of your weapon damage, Attack Power and Sign Intensity multiplied by Adrenaline Points and divided by the number of enemies. The effect lasts for $S$ sec and can only be activated once per $S$ sec. Current max drain rate: $S$/sec.
2110992547|b4ca2ff0||Life Leech
2110992548|da7e5ba1||Crossbow bolts deal $F$ pts more base damage.
2110992549|cea74415||Each bolt that hits its target now generates the same amount of Adrenaline Points as when using swords.
2110992550|754d1898||Damage dealt by a bomb's explosion generates $F$ Adrenaline Points. This value is not affected by any Adrenaline gain bonuses.
2110992551|c3f5389b||When drawn, magic, relic and witcher swords increase Sign base damage by $S$% of their own base damage.
2110992552|bab1daf7||Allows to imbibe up to $S$ decoction(s) with no toxicity cost. Each free decoction imbibed increases your chances to apply critical effects with both swords and Signs by $S$% (effect chance increases by $S$ times max). Witcher Senses help you see better in dark places.
2110992553|15dda918||Decreases decoction toxicity by $S$%.
