;meta[language=cz]
; id      |key(hex)|key(str)| text
;
; comment lines use ; as first character
; all comment lines (except the two line header) will be ignored
;
2110992000|        |panel_Mods|Mods
2110992001|        |panel_ghost_mode|Ghost Mode
2110992002|        |option_gm_health_multiplier|Modifikátor zdraví nepřátel: 
2110992003|        |option_gm_damage_multiplier|Modifikátor poškození nepřátel: 
2110992004|        |option_gm_enemies_scaling|Navyšování úrovně nepřátel
2110992005|        |preset_value_gm_es_none|Nenavyšovat 
2110992006|        |preset_value_gm_es_upscale|Navýšit
2110992007|        |preset_value_gm_es_match|Rovná se Geraltově úrovni
2110992008|        |option_gm_boss_health_multiplier|Additional health modifier for bosses
2110992009|        |option_gm_boss_damage_multiplier|Additional damage modifier for bosses
2110992013|        |attribute_name_frost_resistance_perc|Odolnost proti mrazu
2110992014|        |attribute_name_armor_reduction_perc|Snížení nepřítelovi odolnosti proti poškození
2110992015|        |attribute_name_potion_duration|Trvání účinku lektvaru
2110992016|        |preset_value_gm_es_soft|Mírné navýšení 
2110992017|        |panel_common_statistics_tooltip_silver_dph_gm|Poškození za každý zásah (stříbro)
2110992018|        |panel_common_statistics_tooltip_steel_dph_gm|Poškození za každý zásah (ocel)
2110992019|        |gm_sign_stats_channeling_damage_per_sec|Poškození proudem ohně za sekundu
2110992020|        |gm_sign_stats_yrden_traps|Magické pasti
2110992021|        |gm_sign_stats_yrden_damage|Poškození magické pasti
2110992022|        |gm_sign_stats_alt_yrden_duration|Trvání magické střílny
2110992023|        |gm_sign_stats_alt_yrden_charges|Zásobníky magické střílny
2110992024|        |gm_sign_stats_alt_yrden_damage|Poškození magické střílny                                   
2110992025|        |gm_sign_stats_alt_quen_returned_damage|Vrácené poškození
2110992026|        |gm_sign_stats_alt_quen_dmg_absorption|Pohlcení poškození aktivního štítu
2110992027|        |gm_sign_stats_alt_axii_chance|Šance na alternativní efekt při seslání Axie
2110992028|        |gm_combat_stats_fast_attack_power|Síla rychlého útoku
2110992029|        |gm_combat_stats_strong_attack_power|Síla silného útoku
2110992030|        |gm_sign_stats_quen_dmg_absorption|Pohlcené poškození
2110992034|        |attribute_name_vsBeast_critical_hit_chance|Šance kritického zásahu proti zvířatům
2110992035|        |attribute_name_vsCursed_critical_hit_chance|Šance kritického zásahu proti prokletým
2110992036|        |attribute_name_vsDraconide_critical_hit_chance|Šance kritického zásahu proti drakovitým
2110992037|        |attribute_name_vsHuman_critical_hit_chance|Šance kritického zásahu proti lidem
2110992038|        |attribute_name_vsHybrid_critical_hit_chance|Šance kritického zásahu proti hybridům
2110992039|        |attribute_name_vsInsectoid_critical_hit_chance|Šance kritického zásahu proti hmyzovitým
2110992040|        |attribute_name_vsMagicals_critical_hit_chance|Šance kritického zásahu proti elementálům
2110992041|        |attribute_name_vsNecrophage_critical_hit_chance|Šance kritického zásahu proti nekrofágům
2110992042|        |attribute_name_vsRelic_critical_hit_chance|Šance kritického zásahu proti reliktům
2110992043|        |attribute_name_vsSpecter_critical_hit_chance|Šance kritického zásahu proti přeludům
2110992044|        |attribute_name_vsOgre_critical_hit_chance|Šance kritického zásahu proti zlobrovitým
2110992045|        |attribute_name_vsVampire_critical_hit_chance|Šance kritického zásahu proti upírům
2110992046|        |attribute_name_vsBeast_critical_hit_damage_bonus|Síla kritického zásahu proti zvířatům
2110992047|        |attribute_name_vsCursed_critical_hit_damage_bonus|Síla kritického zásahu proti prokletým
2110992048|        |attribute_name_vsDraconide_critical_hit_damage_bonus|Síla kritického zásahu proti drakovitým
2110992049|        |attribute_name_vsHuman_critical_hit_damage_bonus|Síla kritického zásahu proti lidem
2110992050|        |attribute_name_vsHybrid_critical_hit_damage_bonus|Síla kritického zásahu proti hybridům
2110992051|        |attribute_name_vsInsectoid_critical_hit_damage_bonus|Síla kritického zásahu proti hmyzovitým
2110992052|        |attribute_name_vsMagicals_critical_hit_damage_bonus|Síla kritického zásahu proti elementálům
2110992053|        |attribute_name_vsNecrophage_critical_hit_damage_bonus|Síla kritického zásahu proti nekrofágům
2110992054|        |attribute_name_vsRelic_critical_hit_damage_bonus|Síla kritického zásahu proti reliktům
2110992055|        |attribute_name_vsSpecter_critical_hit_damage_bonus|Síla kritického zásahu proti přeludům
2110992056|        |attribute_name_vsOgre_critical_hit_damage_bonus|Síla kritického zásahu proti zlobrovitým
2110992057|        |attribute_name_vsVampire_critical_hit_damage_bonus|Síla kritického zásahu proti upírům
2110992058|        |attribute_name_vsBeast_resist_reduction|Snížení odolnosti před poškozením proti zvířatům
2110992059|        |attribute_name_vsCursed_resist_reduction|Snížení odolnosti před poškozením proti prokletým
2110992060|        |attribute_name_vsDraconide_resist_reduction|Snížení odolnosti před poškozením proti drakovitým
2110992061|        |attribute_name_vsHuman_resist_reduction|Snížení odolnosti před poškozením proti lidem
2110992062|        |attribute_name_vsHybrid_resist_reduction|Snížení odolnosti před poškozením proti hybridům
2110992063|        |attribute_name_vsInsectoid_resist_reduction|Snížení odolnosti před poškozením proti hmyzovitým
2110992064|        |attribute_name_vsMagicals_resist_reduction|Snížení odolnosti před poškozením proti elementálům
2110992065|        |attribute_name_vsNecrophage_resist_reduction|Snížení odolnosti před poškozením proti nekrofágům
2110992066|        |attribute_name_vsRelic_resist_reduction|Snížení odolnosti před poškozením proti reliktům
2110992067|        |attribute_name_vsSpecter_resist_reduction|Snížení odolnosti před poškozením proti přeludům
2110992068|        |attribute_name_vsOgre_resist_reduction|Snížení odolnosti před poškozením proti zlobrovitým
2110992069|        |attribute_name_vsVampire_resist_reduction|Snížení odolnosti před poškozením proti upírům
2110992070|        |attribute_name_vsHuman_attack_power|Síla útoku proti lidem
2110992071|da7e5ba4||Každá část lehké zbroje zvyšuje šanci na kritický zásah o $S$% a sílu kritického zásahu o $S$%.
2110992072|da7e5ba6||Každá část těžké zbroje zvyšuje maximální zdraví o $S$%, uštědřené poškození útoky na blízko dává navíc $S$ adrenalinových bodů za každou další část těžké zbroje.
2110992073|163a8e78||Zvyšuje šanci na podpálení o $I$%.
2110992074|3c4a6af2||Poškození silným útokem
2110992075|5806ca6e||Kritické poškození silným útokem
2110992076|69d8dd89||Kritické poškození rychlým útokem
2110992077|89dfeac9||Šance na kritický zásah rychlým útokem
2110992078|bc4297c4||Šance na kritický zásah silným útokem
2110992079|d23992f7||Poškození rychlým útokem
2110992080|2e06698e||Kritické poškození silným útokem
2110992081|3375c4a9||Kritické poškození rychlým útokem
2110992082|73d42fa9||Šance na kritický zásah rychlým útokem
2110992083|b08bd7d2||Poškození silným útokem
2110992084|c7b0b7d7||Poškození rychlým útokem
2110992085|fa3924a4||Šance na kritický zásah silným útokem
2110992090|6c1d3ba3||Petardy jsou hozeny bez prodlevy a mohou způsobit kritické poškození. Každá část setu zvyšuje šanci kritického zásahu petardou o $S$% (současný bonus: $S$%) a sílu kritického zásahu petardou o $S$% (současný bonus: $S$%).
2110992091|85e8fbd1||Každá část setu zvyšuje efektivitu aplikovaného oleje na meči o $S$% (současný bonus: $S$%).
2110992092|1f70c024||Fast attacks have $S$% chance to apply Bleeding effect. The final damage dealt by fast attacks to bleeding enemies is increased by $S$%.
2110992093|71d0c5a6||Alternativní režim znamení:<br>Způsobuje $I$ bodů poškození nepřátelům v rozmezí $I$ yardů. Poškození se zvyšuje s intenzitou znamení (současné poškození je: $I$). Ignores enemy Armor. Ničí střely procházející oblastí účinku. Trvá po dobu $I$ sekund. Zásobníky střílny - $I$.
2110992094|71d0c5a5||Alternativní režim znamení:<br>Způsobuje $I$ bodů poškození nepřátelům v rozmezí $I$ yardů. Poškození se zvyšuje s intenzitou znamení (současné poškození je: $I$). Ignores enemy Armor. Ničí střely procházející oblastí účinku. Trvá po dobu $I$ sekund. Zásobníky střílny - $I$.
2110992095|163a8e72||Alternativní režim znamení:<br>Způsobuje $I$ bodů poškození nepřátelům v rozmezí $I$ yardů. Poškození se zvyšuje s intenzitou znamení (současné poškození je: $I$). Ignores enemy Armor. Ničí střely procházející oblastí účinku. Trvá po dobu $I$ sekund. Zásobníky střílny - $I$.
2110992096|b1173fc9||Až dva protivníci mohou být ve stejný okamžik ovlivněni Axie. Trvání efektu je sníženo o $I$%.
2110992097|c8467d3c||Až dva protivníci mohou být ve stejný okamžik ovlivněni Axie. Trvání efektu je sníženo o $I$%.
2110992098|c8467d3d||Až dva protivníci mohou být ve stejný okamžik ovlivněni Axie. Trvání efektu není nadále sníženo.
2110992099|1f70c022||Each Adrenaline Point adds $I$% to the chance of killing an opponent instantly when countering (up to $I$% max).
2110992102|1f70c021||Strong attack that goes through blocks, armor and shields and can knock down enemies. If $S$ Adrenaline Points are available, creates a powerful shock wave that damages all the enemies in a $S$-yard radius, staggering them or knocking them down. Increases weapon damage by $S$%. Each Stamina and Adrenaline point spent additionally increase weapon damage: by $S$% and $S$% respectively (up to $S$% max). Critical hit chance is increased by $S$%.
2110992103|1f70c020||Spinning attack that strikes all foes in the surrounding area. Maintaining the attack consumes $S$ Stamina. During the attack Adrenaline is drained at a speed of $S$ pts/sec. While performing the attack at non-zero Adrenaline, Attack Power is increased by $S$% per additional attacker (max. $S$%) and damage received is decreased by $S$%.
2110992104|064143d3||Spinning attack that strikes all foes in the surrounding area. Maintaining the attack consumes $S$ Stamina. During the attack Adrenaline is drained at a speed of $S$ pts/sec. While performing the attack at non-zero Adrenaline, Attack Power is increased by $S$% per additional attacker (max. $S$%) and damage received is decreased by $S$%.
2110992105|        |gm_stat_adrenaline_gain|Přísun adrenalinu
2110992106|739e1e2c||Chained fast hits add +$S$% to Attack Power for each piece of the set (currently +$S$%), up to +$S$% max. Finishing a chain of fast hits with a strong hit discharges the sword doubling the current Attack Power bonus. The bonus resets when the chain of hits stops and at the end of the combat.
2110992107|8ed43e3e||Casting a sign reduces stamina cost of all the subsequent actions taken by $S$% for each piece of the set. Current bonus: $S$%. Lasts for $S$ sec.
2110992108|8ed43e3f||Rozsah pastí Yrdenu je zvýšen o $S$%. Dokud jsi uvnitř Yrdenu, je intenzita znamení zvýšena o $S$% a odolnost vůči poškození je zvýšena o $S$%.
2110992109|739e1e2d||Kritické zásahy mečem zdvojnásobují získaný adrenalin.
2110992110|        |attribute_name_dockdownchance_mult|Šance na sražení
2110992111|c3f538a3||Crossbow bolts deal $S$% more base damage and will pierce and either stun or knock down opponents. Opponents at full health lose $S$% of their health when shot. If at non-zero toxicity, time slows down by additional $S$% when aiming with a crossbow.
2110992112|        |effect_undying_skill|Účinky schopnosti Nehynoucí
2110992113|c1e6a9cc||Pokud zdraví klesne na nulu, aby se předešlo smrti, spotřebují se body adrenalinu, a získáš na $S$ sekund zvýšené zdraví a dočasnou nezranitelnost. Obnoví $S$% zdraví za každý bod adrenalinu (max. $S$%) a nemůže být použito víc než jednou za každých $S$ sekund.
2110992114|c1e6a9cb||Pokud zdraví klesne na nulu, aby se předešlo smrti, spotřebují se body adrenalinu, a získáš na $S$ sekund zvýšené zdraví a dočasnou nezranitelnost. Obnoví $S$% zdraví za každý bod adrenalinu (max. $S$%) a nemůže být použito víc než jednou za každých $S$ sekund.
2110992115|cea74418||Pokud zdraví klesne na nulu, aby se předešlo smrti, spotřebují se body adrenalinu, a získáš na $S$ sekund zvýšené zdraví a dočasnou nezranitelnost. Obnoví $S$% zdraví za každý bod adrenalinu (max. $S$%) a nemůže být použito víc než jednou za každých $S$ sekund.
2110992116|cea74430||Síla útoku rychlými útoky je zvýšena o $S$%. Přísun adrenalinu pro rychlé útoky je zvýšen o $S$%.
2110992117|1f70c023||Síla útoku silnými útoky je zvýšena o $S$%. Přísun adrenalinu pro silné útoky je zvýšen o $S$%.
2110992118|cea74417||Zvyšuje šanci kritického zásahu rychlým útokem o $I$% a sílu kritického zásahu rychlým útokem o $I$%.
2110992119|1f70c027||Zvyšuje šanci kritického zásahu silným útokem o $I$% a sílu kritického zásahu silným útokem o $I$%.
2110992120|c1e68bc4||Damage taken from partial parries and counters is reduced by additional $I$% (down to $I$% total). Perfectly timed parries reflect back arrows, damage on reflected arrows is increased by $I$%. When multiple enemies are around, parry cost is decreased by $I$%.
2110992121|c1e68f84||Increases counterattack power by $I$% and critical hit chance by $I$%.
2110992122|c1e68f85||Increases counterattack power by $I$% and critical hit chance by $I$%. Each Adrenaline Point grants $I$% knockdown chance when countering (up to $I$% max).
2110992123|cea74411||Increases counterattack power by $I$%.
2110992124|cf2b2da2||Protective shield that absorbs up to $I$% of damage dealt by enemy's weapon. Base damage absorption: $I$. Scales with Sign intensity. Current absorption: $I$. Prevents stagger, burning, poison and bleeding effects (and then breaks). <br>Shield duration: $I$s.
2110992125|163a8e77||Igni hit now also decreases enemy Armor by $S$ point(s) and enemy Damage Resistances by $S$% (scales with Sign Intensity) for $S$ sec. Subsequently applied effects do not cumulate.
2110992126|cf2b2da0||Sprška ohně, která způsobuje $I$ bodů poškození, s $I$% šancí podpálit nepřátele. Poškození se zvyšuje s intenzitou znamení. Současné poškození: $I$.
2110992127|163a8e71||Alternativní režim znamení:<br>Vysílá nepřetržitý proud ohně, který způsobuje podpálení a přidává $I$ bodů poškození za sekundu. Poškození se zvyšuje s intenzitou znamení (současné poškození: $I$). Spotřebovává $I$ bodů výdrže za sekundu.
2110992128|71d0c1e4||Alternativní režim znamení:<br>Vysílá nepřetržitý proud ohně, který způsobuje podpálení a přidává $I$ bodů poškození za sekundu. Poškození se zvyšuje s intenzitou znamení (současné poškození: $I$). Spotřebovává $I$ bodů výdrže za sekundu.
2110992129|71d0c1e5||Alternativní režim znamení:<br>Vysílá nepřetržitý proud ohně, který způsobuje podpálení a přidává $I$ bodů poškození za sekundu. Poškození se zvyšuje s intenzitou znamení (současné poškození: $I$). Spotřebovává $I$ bodů výdrže za sekundu.
2110992130|163a8e75||Aard nyní způsobuje $I$ poškození. Poškození se zvyšuje s intezitou znamení. Současné poškození: $I$.
2110992131|b3c8ebb8||Magická střílna                                                                                             
2110992132|b1173fc0||Magic Trap duration increases by $I$%.
2110992133|        |skill_desc_magic_s10_l2|Magic Trap duration increases by $I$%. Magic Trap radius increases by $I$%.
2110992134|b1173fc1||Increases the final damage taken for all the enemies inside Yrden Trap by $S$%.
2110992135|c84666b6||Když se rozbije, zatlačí štít Quenu protivníky zpět a způsobí jim $I$ bodů poškození. Poškození se zvyšuje s intenzitou znamení (současné poškození: $I$).
2110992136|c84666b7||Když se rozbije, zatlačí štít Quenu se šancí ke sražení protivníky zpět a způsobí jim $I$ bodů poškození. Poškození se zvyšuje s intenzitou znamení (současné poškození: $I$).
2110992137|163a8e73||Alternate Sign Mode:<br>An active shield that absorbs up to 100% of damage dealt by enemy's weapon. Base damage absorption is $I$% bigger. Maintaining it drains $I$ Stamina Points per second. Blocked attacks drain Stamina proportional to damage absorbed. Restores Vitality by $I$% of damage absorbed. Prevents stagger, burning, poison and bleeding effects. Prevents knockdown (and then breaks).
2110992138|71d0c966||Alternate Sign Mode:<br>An active shield that absorbs up to 100% of damage dealt by enemy's weapon. Base damage absorption is $I$% bigger. Maintaining it drains $I$ Stamina Points per second. Blocked attacks drain Stamina proportional to damage absorbed. Restores Vitality by $I$% of damage absorbed. Prevents stagger, burning, poison and bleeding effects. Prevents knockdown (and then breaks).
2110992139|71d0c967||Alternate Sign Mode:<br>An active shield that absorbs up to 100% of damage dealt by enemy's weapon. Base damage absorption is $I$% bigger. Maintaining it no longer drains Stamina. Blocked attacks drain Stamina proportional to damage absorbed. Restores Vitality by $I$% of damage absorbed. Prevents stagger, burning, poison and bleeding effects. Prevents knockdown (and then breaks).
2110992140|15dda916||S každým dalším zásahem přidává vhodně aplikovaný olej na čepele $I$% šanci otrávit protivníka. Vylepšený olej zvyšuje tuto šanci o $I$% a prvotřídní o $I$%. Effectiveness decreases with oil rubbing off the blade (down to $I$% of the original value).
2110992141|15dda91a||If Toxicity is above zero, time automatically slows by $S$% for $S$ sec when an enemy is about to perform a counterattack. Increases Attack Power and Sign Intensity by $S$% when Toxicity exceeds the safe threshold.
2110992142|1517d64d||If Toxicity is above zero, time automatically slows by $S$% for $S$ sec when an enemy is about to perform a counterattack. Increases Attack Power and Sign Intensity by $S$% when Toxicity exceeds the safe threshold.
2110992143|1517d64e||If Toxicity is above zero, time automatically slows by $S$% for $S$ sec when an enemy is about to perform a counterattack. Increases Attack Power and Sign Intensity by $S$% when Toxicity exceeds the safe threshold.
2110992145|329005f0||Allows you to perform strong melee attacks which add +$I$% to weapon damage and +$I$ to Armor Penetration.
2110992148|bab1daf5||Increases Vitality drain on overdosing by $S$% for every 1 point in your Toxicity level (current Vitality drain value: $S$ pts; max value: $S$ pts). The amount of Vitality you lose when overdosing is added to your base weapon and Sign damage.
2110992149|c3f5389c||Signs can deal critical hits. Their critical hit chance and power are determined by Sign Intensity (current critical hit chance -  $S$%, critical hit power bonus - $S$%). Opponents killed by critical hits from Signs explode.
2110992150|c3f538a0||Když se sešle znamení Aard, má dodatečnou $S$% šanci ke zmražení protivníků. Protivníci, co jsou současně zmraženi a sraženi, zemřou okamžitě. Protivníci, kteří nejsou zmraženi, utrží $S$ dodatečného poškození. Poškození se zvyšuje s intenzitou znamení. Současné poškození: $S$.
2110992151|cf2b2da1||Magic trap that slows enemies down by $S$% inside its area of effect (scales with Sign Intensity, max slowdown is limited by $S$%). Trap duration: $S$s. The longer the trap persists, the less efficient it becomes.
2110992152|c3f538a1||While in combat you alternate between two states: Rush state that doubles your Adrenaline gain for $S$ sec and gives additional +$S$% to Attack Power and Sign Intensity per Adrenaline Point and Recovery state that halves your Adrenaline gain for $S$ sec and gives -$S$% to the same characteristics for each Adrenaline point gained during the Rush state.
2110992153|c32e766a||Bonus za sílu kritického zásahu
2110992154|28838f82||Průraznost zbroje
2110992155|f35fcb73||Průraznost zbroje
2110992156|        |attribute_name_vitalityRegen|Regenerace zdraví mimo boj
2110992157|        |attribute_name_vitalityCombatRegen|Regenerace zdraví během boje
2110992158|c95c6e28||When at maximum Vitality, additional Vitality regeneration increases your weapon damage by $I$% per 1% of excess Vitality gained (up to +$I$%). Works only in combat. Resets on damage taken and damage dealt.
2110992159|ccc61f66||Všechno jídlo účinkuje o $I$% déle, ale chutná jako knedlíčky.
2110992160|22156cd6||When Yrden Magic Turret hits an enemy, an Yrden Magic Trap is placed at that position. Size, duration and slowdown for such a trap are unaffected by Yrden Intensity and upgrades and limited to $S$ yards, $S$ sec and $S$% respectively.
2110992161|        |attribute_name_spell_dmg_bonus|Poškození znamením
2110992162|        |attribute_name_sword_dmg_bonus|Poškození zbraní
2110992163|7968d6e0||Zmrazí soupeře. Údery zasazené zmraženým nepřátelům způsobují dodatečná poškození. Prodloužené trvání.
2110992164|b02a28c2||Zvýšení poškození
2110992165|9e58d1f5||Zvyšuje intenzitu znamení. Prodloužené trvání. Speciální účinky znamení jsou o jednu třetinu delší.
2110992166|329005f3||Damage dealt during melee combat generates Adrenaline Points. Each Adrenaline Point increases Attack Power by $I$%.
2110992167|        |gm_combat_stats_fast_crit_attack_power|Síla kritického zásahu rychlým útokem
2110992168|        |gm_combat_stats_strong_crit_attack_power|Síla kritického zásahu silným útokem
2110992169|        |gm_used_razor_success|Geralt je nyní hladce oholen
2110992170|329005f2||Umožňuje třímat lehkou kuši. Střelba bez míření působí o 50% menší poškození.
2110992171|5f63dbf5||Umožňuje výrobu petard, které mohou být vrženy na nepřátele. Házení bez míření působí o 50% menší poškození.
2110992172|754d1891||Jako dodatečný efekt obvyklého účinku bojového transu, každý bod adrenalinu dále zvyšuje intenzitu znamení o $I$%. Používání znamení nyní generuje stejný počet adrenalinových bodů jako při použití mečů.
2110992173|        |item_desc_razor_mod|Používá se na holení.
2110992174|da7e5ba5||Každá část střední zbroje zvyšuje intenzitu znamení o $S$% a snižuje spotřebu výdrže seslaných znamení o $S$%.
2110992175|b1173fc7||Time is slowed down by additional $I$% while casting Axii. A chance to critically hit a confused opponent is increased by $I$%. Increases the effectiveness of Axii in dialogues.
2110992176|c84675ba||Time is slowed down by additional $I$% while casting Axii. A chance to critically hit a confused opponent is increased by $I$%. Increases the effectiveness of Axii in dialogues.
2110992177|c84675bb||Time is slowed down by additional $I$% while casting Axii. A chance to critically hit a confused opponent is increased by $I$%. Increases the effectiveness of Axii in dialogues.
2110992178|56747c57||Zrychlení regenerace zdraví. Při utrženém poškození se regenerace zdraví nezastaví.
2110992179|        |gm_geralt_too_heavy|Tvé přetížení je příliš vysoké
2110992180|        |option_gm_sink_boat_toggle|Při přetížení se loďka potopí:
2110992181|        |option_gm_sink_boat_slider|Práh přetížení k potopení loďky: (%)
2110992182|        |gm_switch_inv_mode|Přepnout režim nastavení inventáře
2110992183|        |option_gm_encumbrance_slider|Snížení váhy předmětu: (%)
2110992184|        |gm_normal_inv_mode|Nastavení běžného režimu Geraltova inventáře
2110992185|        |gm_stash_inv_mode|Nastavení režimu uložiště
2110992186|        |gm_mixed_inv_mode|Nastavení režimu kombinace inventáře
2110992187|        |gm_synchronized_inv_mode|Nastavení režimu synchronizace inventáře
2110992188|e71d7c90||Increases Geralt's base Vitality by $S$ points with each foe killed.
2110992189|d3510d11||Obsahuje stříbrné střepy, které dočasně blokují nebo oslabují schopnost přeměny příšer a jejich regeneraci.
2110992190|d3510d12||Obsahuje stříbrné střepy, které dočasně blokují nebo oslabují schopnost přeměny příšer a jejich regeneraci. Prodloužené trvání.
2110992191|d3510d13||Obsahuje stříbrné střepy, které dočasně blokují nebo oslabují schopnost přeměny příšer a jejich regeneraci. Prodloužené trvání.
2110992192|08eace65||Zvyšuje efektivitu útoku proti hmyzovitým. Efektivita se snižuje stíráním oleje z čepele během boje.
2110992193|08eace66||Zvyšuje efektivitu útoku proti hmyzovitým. Efektivita se snižuje stíráním oleje z čepele během boje.
2110992194|08eace67||Zvyšuje efektivitu útoku proti hmyzovitým. Efektivita se snižuje stíráním oleje z čepele během boje.
2110992195|3a67f159||Zvyšuje efektivitu útoku proti prokletým. Efektivita se snižuje stíráním oleje z čepele během boje.
2110992196|3a67f15a||Zvyšuje efektivitu útoku proti prokletým. Efektivita se snižuje stíráním oleje z čepele během boje.
2110992197|3a67f15b||Zvyšuje efektivitu útoku proti prokletým. Efektivita se snižuje stíráním oleje z čepele během boje.
2110992198|65067e25||Zvyšuje efektivitu útoku proti nekrofágům. Efektivita se snižuje stíráním oleje z čepele během boje.
